<?xml version="1.0" encoding="UTF-8"?>
<meteo xmlns:xsi="http://www.w3.org/2001/XMLSchema-instance"
    xsi:noNamespaceSchemaLocation="file:/C:/Users/Parfait%20DIMBA/Documents/OxygenXMLEditor/samples/meteo/meteo.xsd">
    <mesure date="2024-11-11">
        <ville nom="casablanca" temperature="22"/>
        <ville nom="Mohammedia" temperature="23"/>
        <ville nom="Marrakech" temperature="32"/>
        <ville nom="Tanger" temperature="25"/>
        <ville nom="El Jadida" temperature="26"/>
        <ville nom="LAAYOUNE" temperature="34"/>
        <ville nom="Ouarzazate" temperature="36"/>
        <ville nom="Dakhla" temperature="34"/>
        <ville nom="Oudja" temperature="31"/>
    </mesure>
    <mesure date="2024-11-12">
        <ville nom="casablanca" temperature="20"/>
        <ville nom="Mohammedia" temperature="21"/>
        <ville nom="Marrakech" temperature="30"/>
        <ville nom="Tanger" temperature="28"/>
        <ville nom="El Jadida" temperature="27"/>
        <ville nom="LAAYOUNE" temperature="32"/>
        <ville nom="Ouarzazate" temperature="32"/>
        <ville nom="Dakhla" temperature="34"/>
        <ville nom="Oudja" temperature="28"/>
    </mesure>
</meteo>